{
  "approval_id": "approval_s01_entropy_bridge_001",
  "scenario_id": "S01",
  "gate": "G2",
  "state": "approved",
  "requested_action": {
    "action_id": "act_s01_entropy_bridge_publish",
    "label": "엔트로피 정의 브리지 설명과 확인 문제 1개를 W7 Lecture 2 앞에 추가합니다."
  },
  "source_card_id": "xai_s01_instructor_intervention_001",
  "approver_role": "instructor",
  "requested_at": "2026-04-10T11:00:00+09:00",
  "approved_at": "2026-04-10T11:08:00+09:00",
  "rollback_note": "게시 후 학생 혼란 지표가 상승하거나 교수자가 부적합하다고 판단하면 원본 Lecture 2 구성으로 되돌립니다."
}
