{
  "approval_id": "approval_s11_bridge_variant_001",
  "scenario_id": "S11",
  "gate": "G2",
  "state": "approved",
  "requested_action": {
    "action_id": "act_s11_publish_bridge_variant",
    "label": "Teaching Profile에 맞춘 엔트로피 브리지 초안을 검토 후 게시합니다."
  },
  "source_card_id": "xai_s11_cocreation_001",
  "approver_role": "instructor",
  "requested_at": "2026-04-11T09:05:00+09:00",
  "approved_at": "2026-04-11T09:16:00+09:00",
  "rollback_note": "학생 혼란 지표 또는 교수자 판단에 따라 초안을 비공개 처리하고 기존 자료로 되돌립니다."
}
